{
  "schema": 1,
  "items": [
    {
      "id": "a_7Hn3Wc",
      "platform": "switch",
      "title_id": "0100ABCD00010000",
      "app_id": "0100ABCD00010000",
      "type": "base",
      "version_code": 0,
      "version_name": "1.0.0",
      "name": "Frostline Tales",
      "size": 5368709120,
      "format": "xci",
      "sha256": "3a7bd3e2b4c1f0a9e8d7c6b5a4938271605f4e3d2c1b0a9f8e7d6c5b4a392817",
      "added": "2026-10-28T19:02:11Z",
      "file": "/api/lantern/v1/files/f_Pq02Rt",
      "atlas": "Q900001",
      "installed_size": 10737418240
    },
    {
      "id": "a_9Qx2Lm",
      "platform": "switch",
      "title_id": "0100ABCD00010000",
      "app_id": "0100ABCD00010800",
      "type": "update",
      "version_code": 196608,
      "version_name": "1.3.0",
      "name": "Frostline Tales",
      "size": 734003200,
      "format": "nsz",
      "sha256": "3a7bd3e2b4c1f0a9e8d7c6b5a4938271605f4e3d2c1b0a9f8e7d6c5b4a392817",
      "added": "2026-10-28T19:02:11Z",
      "file": "/api/lantern/v1/files/f_Zk81Qp"
    },
    {
      "id": "a_Lw4Tq8",
      "platform": "android",
      "title_id": "org.example.frostlinetales",
      "app_id": "org.example.frostlinetales",
      "type": "base",
      "version_code": 12,
      "version_name": "1.2.0",
      "name": "Frostline Tales",
      "size": 98566144,
      "format": "apk",
      "sha256": "9f2c41aa0b7e5d3c18f6a2b4c0d9e8f7a6b5c4d3e2f1a0b9c8d7e6f5a4b3c2d1",
      "added": "2026-10-29T10:00:00Z",
      "file": "/api/lantern/v1/files/f_Tn55Vb"
    }
  ],
  "total": 4123,
  "next": "c_Kp9w"
}
