{
  "schema": 1,
  "items": [
    {
      "id": "r_14",
      "user": "sam",
      "platform": "switch",
      "title_id": "0100A1B200030000",
      "name": "Paper Comets",
      "status": "open",
      "created": "2026-10-29T17:40:00Z",
      "updated": "2026-10-29T17:40:00Z"
    },
    {
      "id": "r_12",
      "user": "lea",
      "platform": "switch",
      "title_id": "0100EFEF00020000",
      "name": "Harbor Lights",
      "status": "declined",
      "created": "2026-10-27T18:00:00Z",
      "updated": "2026-10-28T09:15:00Z",
      "reason": "This shelf keeps only games the household owns on cartridge."
    }
  ],
  "total": 2,
  "next": null
}
