{
  "schema": 1,
  "items": [
    {
      "name": "lea",
      "state": "active",
      "scopes": [
        "library",
        "saves",
        "admin"
      ],
      "devices": 3,
      "created": "2026-10-01T09:00:00Z"
    },
    {
      "name": "sam",
      "state": "active",
      "scopes": [
        "library"
      ],
      "devices": 2,
      "created": "2026-10-30T18:00:00Z"
    }
  ],
  "total": 2,
  "next": null
}
